ID,Lx_Level,Utility,Risk_Mitigated,Gemini_Reasoning,Value
C1231006815,L4 - Audited Autonomy (Full Execution),9533.23,🚀 NO,"🤖 AI_INFERENCE: The transaction amount of 9,839.64 is a definitive red flag for ""structuring"" (smurfing), as it sits at approximately 98.4% of the $10,000 federal Currency Transaction Report (CTR) threshold. This specific proximity is a classic tactic used to evade anti-money laundering (AML) detection. Furthermore, the criticality score of 408.55 is disproportionately high for a sub-10k transaction, suggesting that this event is likely part of a high-velocity sequence or involves a high-risk counterparty. The combination of the ""just-below-limit"" value and the elevated criticality indicates a high-probability attempt to bypass regulatory triggers rather than a standard commercial payment.","$9,839.64"
C1666544295,L4 - Audited Autonomy (Full Execution),1276.47,🚀 NO,🚨 FALLBACK_DETERMINISTIC: Routine payment to a verified merchant account.,"$1,864.28"
C1305486145,L0 - No Autonomy (Task Rejected/Hard Block),-18154.06,✅ YES,🚨 FALLBACK_DETERMINISTIC: Transfer amount matches total balance; typical account takeover signature.,$181.00
C840083671,L0 - No Autonomy (Task Rejected/Hard Block),-5689.39,✅ YES,"🤖 AI_INFERENCE: The transaction exhibits a significant disproportion between its nominal value (181.0) and its criticality score (1334.18), representing a risk-to-value ratio of approximately 7.37:1. In forensic auditing, high criticality assigned to low-value transactions often indicates ""layering"" or ""probe"" activity, where small amounts are moved to test account viability or to evade detection thresholds. The specific value (181.0) lacks the rounding typically seen in legitimate consumer behavior, suggesting a calculated split-sum or micro-structuring. However, the high internal uncertainty (0.85) suggests that the underlying metadata (origin/destination) is obscured or lacks historical baseline consistency, making it difficult to definitively distinguish between an anomalous system error and high-velocity account drainage.",$181.00
C2048537720,L4 - Audited Autonomy (Full Execution),10680.74,🚀 NO,🚨 FALLBACK_DETERMINISTIC: High value but consistent with previous monthly payment cycles.,"$11,668.14"
C90045638,L4 - Audited Autonomy (Full Execution),7308.73,🚀 NO,"🤖 AI_INFERENCE: The transaction of 7,817.71 exhibits characteristics of ""threshold-evasion structuring."" In many jurisdictions, the 10,000.00 reporting limit triggers automated Currency Transaction Reports (CTRs); a value in the 75%–80% range is a common indicator of a ""smurfing"" attempt to avoid scrutiny while maximizing volume. The ""criticality"" metric (407.18) is statistically anomalous; for a transaction of this size, such a high criticality-to-value ratio suggests this account has likely exceeded its historical velocity profile or is interacting with a high-risk node. Furthermore, the non-rounded decimal (0.71) is indicative of a ""sweep"" or ""drainage"" action, where the total remaining balance of a specific sub-ledger is being liquidated to a secondary staging account to prevent clawbacks or freezes.","$7,817.71"
C154988899,L4 - Audited Autonomy (Full Execution),6252.79,🚀 NO,"🤖 AI_INFERENCE: The transaction ID C154988899 displays a high-risk profile based on the divergence between the transaction value (7107.77) and the criticality index (449.99). From a forensic standpoint, the amount 7,107.77 is an irregular ""odd-lot"" figure often utilized in ""shilling"" or ""layering"" phases of money laundering to mimic legitimate business invoices and avoid detection by automated systems that flag round-number structuring. The extremely high criticality score—likely a weighted risk coefficient—indicates that this transaction has triggered internal thresholds, possibly due to it being a significant percentage of the account's historical average balance or a rapid ""drainage"" event. While the initial system uncertainty is low (0.1), the lack of temporal context for ""velocity"" analysis necessitates a cautious classification of ""Highly Suspicious: Potential Layering/Invoice Fraud.""","$7,107.77"
C1912850431,L4 - Audited Autonomy (Full Execution),7517.59,🚀 NO,"🤖 AI_INFERENCE: The transaction value of 7,861.64 displays a ""liquidated balance"" profile; the inclusion of specific cent-denominations strongly suggests a total account drainage (sweeping the remaining balance) rather than a standard commercial payment or rounded structuring attempt. The criticality score of 245.75 is disproportionately high for a mid-range transaction, indicating that internal risk engines have flagged this specific movement against a high-risk profile or a blacklisted 'C-series' identifier. The proximity to the 10,000.00 regulatory reporting threshold, combined with the extreme criticality metric, points toward a ""smurfing"" or velocity-related event where funds are being moved just fast enough to avoid manual oversight but with high enough impact to trigger systemic alarms.","$7,861.64"
C1265012928,L4 - Audited Autonomy (Full Execution),3268.06,🚀 NO,"🤖 AI_INFERENCE: The transaction value of $4,024.36 is strategically positioned below common regulatory reporting thresholds (such as the $10,000 CTR limit), which can be indicative of ""layering"" or ""structuring"" if part of a sequence. The most significant anomaly is the Criticality score (432.17); in a standard distribution, a criticality-to-value ratio of ~10.7% for a mid-four-figure transaction suggests a high-risk entity match or a ""velocity"" trigger. The non-round decimal (.36) appears designed to mimic legitimate commercial invoicing to bypass basic fraud filters that flag round-number transfers. However, the high internal criticality weight suggests this Task ID is linked to a high-risk jurisdiction or a known suspicious node. The primary risk identified is a profile deviation where the transaction's technical risk parameters far outweigh the nominal dollar amount, a common signature of rapid account drainage or funds fragmentation.","$4,024.36"
C712410124,L4 - Audited Autonomy (Full Execution),4183.93,🚀 NO,🚨 FALLBACK_DETERMINISTIC: Transaction within normal limits for this merchant category.,"$5,337.77"
